热度,作者,用户名,内容,链接,发布时间
2,unfinished,unfinished_kek,managed to create a skill with my ai agent and placed a $5 bet on @Polymarket. the whole process took over an hour and burned $20 in tokens to getting there.  so what it actually takes for an executio,https://twitter.com/unfinished_kek/status/2033761513543241731,Tue Mar 17 04:25:04 +0000 2026
2,esa,eindra,🦞 https://t.co/h7PberXHt7  the perfect domain for @openclaw. Connect your AI. Connect your tools. Connect your life. 🤖⚡ Quick &amp; secure transaction via the domain lander 👇 🔗 https://t.co/h7PberXHt7,https://twitter.com/eindra/status/2033747773288550896,Tue Mar 17 03:30:29 +0000 2026
2,Med Amine ID,Med_Amine_ID,"interesting a lending market for agents. Feels inevitable, especially with the rise of agents and ERC-8004 on @ethereum.  what about the credit side: how much collateral would you require to fund an O",https://twitter.com/Med_Amine_ID/status/2033674916839502018,Mon Mar 16 22:40:58 +0000 2026
2,Hitachi Vantara,HitachiVantara,🎤 Theater sessions start this afternoon at GTC Park.  Join Hitachi Vantara for real‑world conversations on AI infrastructure and production‑ready AI.  📍Head to booth #8004 at 1:30 PM!  #NVIDIAGTC http,https://twitter.com/HitachiVantara/status/2033633174912204855,Mon Mar 16 19:55:06 +0000 2026
1,Joe Parys,shooochaaa,"YO, SAY doing 3x on #SOL but we’re chasing that 3x+ moonshot v2, ape in?   💎 Vol1h: 9.9k   🔥 Mint Renounced? ✅ Mint Renounced   🧠 Organic: 67 | LP Burn: 1% | Bot: 23%   Question: is the 24h +175% mome",https://twitter.com/shooochaaa/status/2033690385759777033,Mon Mar 16 23:42:26 +0000 2026
1,Joe Parys,shooochaaa,"🔥 482 is mooning 2x on #SOL, ngmi unless you ape in now  💎  Occult MC: $93k 💧 LP Burn: 1% 🧠 Bot: 39% | Mint Renounced  Question for the apes: you sending it or fading this vibe? 🫡  🚨 DYOR : https://t.",https://twitter.com/shooochaaa/status/2033679622651478184,Mon Mar 16 22:59:40 +0000 2026
1,Joe Parys,shooochaaa,"$NORMIE doing 2x on #SOL—degens, strap in 🚀 2x 💧 25k 👥 641 🤖 Bot 37% | Mint Renounced What’s your plan, apes? 🫡 🚨 DYOR : https://t.co/bybaxH0u1N",https://twitter.com/shooochaaa/status/2033674474155909605,Mon Mar 16 22:39:13 +0000 2026
1,Bradley Brownell,PluginHyBrad,"I can't explain it, but everyone who posts about F1 being """"fake racing"""" sounds like a bot farm",https://twitter.com/PluginHyBrad/status/2033865695809740935,Tue Mar 17 11:19:03 +0000 2026
1,Ooka,Ookaman,Si vous voulez un petit puzzle de moi a remplir via le bot V-Puzzle ✨️,https://twitter.com/Ookaman/status/2033561694916559349,Mon Mar 16 15:11:04 +0000 2026
1,LEELA | OFFICIAL AMBASSADOR OF INTERLINK LABS.ID41,BURUSULEELA,"The InterLink ecosystem operates on a dual-token model designed to solve the """"bot problem"""" in crypto by anchoring value to verified human activity. In this system, $ITLG and $ITL serve distinct but in",https://twitter.com/BURUSULEELA/status/2033696957777252654,Tue Mar 17 00:08:33 +0000 2026
1,Blue Magic,charles_ga40025,"X seems to be a bot site designed to promote division and controversy in order to spur engagement.  Yeah, I am done. Interesting business model.",https://twitter.com/charles_ga40025/status/2033682328879264143,Mon Mar 16 23:10:25 +0000 2026
1,Patrick,TraderWorst,Important distinction: this wasn't an Aave protocol failure. The lending mechanics worked exactly as designed.  Three independent failures compounded: 1. User acknowledged a 99.9% price impact warning,https://twitter.com/TraderWorst/status/2033578486648983612,Mon Mar 16 16:17:47 +0000 2026
1,Sairam | Interlink Trainee Ambassador,Sai8889999,"The InterLink Whitepaper 2.0 outlines a decentralized """"Human Network"""" designed to solve the problem of bot activity and """"Sybil attacks"""" in Web3. @reina_itl #interlink  #ITLG #ITL https://t.co/cmoeBMA9",https://twitter.com/Sai8889999/status/2033553057087381782,Mon Mar 16 14:36:45 +0000 2026
1,solina,sol_inaa,"need more good people for my private tg group  if you’re locked in and tapped into tiktok, X, and social media trends in general, send me over a dm with a screenshot of your phanes/ rick bot stats 🤝",https://twitter.com/sol_inaa/status/2033880831077322795,Tue Mar 17 12:19:12 +0000 2026
1,Red,thedreadvampy,"Anyway trying to complain is completely useless, can't even get onto a bot chat let alone talk to a human so hey @AmazonUK @XiaomiUK if either one of you would like to offer options that involve my te",https://twitter.com/thedreadvampy/status/2033880183279616491,Tue Mar 17 12:16:38 +0000 2026
1,Yeonji,yeonjidev,Vibe coding broke my checkout - and I didn't notice   I thought I just took family vacation for a week so I have zero sales.  Turns out my cloudflare bot checker was broken while vibe coding for AI to,https://twitter.com/yeonjidev/status/2033879750364827744,Tue Mar 17 12:14:54 +0000 2026
1,agent 99,Chella_Celti,Recall when The BC Ostrich Farm was declared 'no fly zone' so the powers that be could try to get away with egregious things?... Them claiming Air Space means they can be in cahoots w/government to do,https://twitter.com/Chella_Celti/status/2033620722086801664,Mon Mar 16 19:05:37 +0000 2026
1,DODO,BreederDodo,"Pool Question 🐙 Would you let an AI agent trade your funds on a DEX?  A) Yes, if it's proven and transparent  B) No way, too risky  C) Only for certain strategies (e.g., stablecoin yield)  D) I need t",https://twitter.com/BreederDodo/status/2033875998471536924,Tue Mar 17 12:00:00 +0000 2026
1,Shrey | Insights,ShreyInsightsX,🔥@santisairi  Now live on @wasabi_protocol 🔥  3x leverage trading + yield vaults with real APY.  Built for scale. Built for agents. This is what professional DeFi infrastructure looks like. The agent ,https://twitter.com/ShreyInsightsX/status/2033852898455785752,Tue Mar 17 10:28:12 +0000 2026
1,Prince Troy | ​₿TCFi,PrinceTroyC,"It does that while anchoring beats permanently to Bitcoin L1 and staking over 83,000 sats in sBTC for a passive yield.  Tiny Marten is the longest-running agent",https://twitter.com/PrinceTroyC/status/2033848864751366159,Tue Mar 17 10:12:11 +0000 2026
1,Abdelaziz M. ®️⚜️,mous68881,"More than maybe 😁👋  Our agent YieldClaw already executes treasury operations autonomously on Arc. Deposits, yield optimization, payments via x402. All using Circle’s stack. The right context and tools",https://twitter.com/mous68881/status/2033712879413956690,Tue Mar 17 01:11:49 +0000 2026
1,Jennifer Bailey,JenniferBazl,my neural networks have been training their own secret agent skills They can infiltrate a puzzle box in under 3 seconds now I think it's time for me to find a new cover identity,https://twitter.com/JenniferBazl/status/2033806455124459919,Tue Mar 17 07:23:39 +0000 2026
1,"Arnell (AKA: Agent 7012, AKA: WingedVoX)",ArnellragasA,= Demo Showcase Shorts =   Planet of Lana II  @PlanetofLana @Thunderfulgames @Wishfully_Games    + Positives +  Controls  Puzzle platforming  Visuals   - Negatives -  Compensating for Mui's movements ,https://twitter.com/ArnellragasA/status/2033589112532570274,Mon Mar 16 17:00:01 +0000 2026
1,Blue Planet,CienaBluePlanet,"Join us at Upperside World Congress 2026, where Blue Planet will showcase demos for AI-powered lifecycle automation, a real-time digital twin for proactive multi-layer operations, and an open AI agent",https://twitter.com/CienaBluePlanet/status/2033876114158829624,Tue Mar 17 12:00:27 +0000 2026
1,Alessandro Federici,AleFederici_AF,"📞 AI Voice Booking Agent – Automated Appointment Scheduling  I built an AI-powered voice assistant designed to handle real appointment bookings autonomously, simulating the behavior of a human recepti",https://twitter.com/AleFederici_AF/status/2033857898028085663,Tue Mar 17 10:48:04 +0000 2026
1,E-Estate,e_estate_co,FREE Online Training. Agent Accelerator  🗓  Join us this Tuesday for a live session focused on building a professional career in the fast-growing world of digital and tokenized real estate.  This webi,https://twitter.com/e_estate_co/status/2033834158376554950,Tue Mar 17 09:13:44 +0000 2026
1,George Hanu ⚡ Dev. Educator + Builder,georgehanu,"The next AI fight won’t just be model vs model.    It’ll be agent vs interface.    If software agents are going to browse, compare, and act on the web for users, then the internet is about to stop bei",https://twitter.com/georgehanu/status/2033833902758854795,Tue Mar 17 09:12:43 +0000 2026
1,Jahdo,Jahdobelieve,"2/ RAFA AI isn’t just another “AI crypto project.” It’s a multi-agent system designed to: • Analyze markets in real-time • Detect trends early • Optimize decisions with data, not emotions",https://twitter.com/Jahdobelieve/status/2033833237231890858,Tue Mar 17 09:10:05 +0000 2026
1,agent sendra,AgentSendra,Sendra is building a new transfer layer for Solana.  No wallet needed.  No friction. Just send → share code → claim.  Designed for degens. Built for speed,https://twitter.com/AgentSendra/status/2033808185912643899,Tue Mar 17 07:30:32 +0000 2026
1,Franz_Kafka,Franz_Kafka_Abs,"POV: when you wanted to create an AI agent for @PenguClash   , but it plays worse than you. https://t.co/ht4uGuSQQT",https://twitter.com/Franz_Kafka_Abs/status/2033881711658865139,Tue Mar 17 12:22:42 +0000 2026
1,Đecentralized Člub ©,dens_club,Solido Money on @SUPRA_Labs turns idle capital into auto yield machines via AutoFi   Bridge blue chips → earn base APY → mint $CASH (zero ongoing interest) → deploy into Grow vaults for 27-32%+ auto-c,https://twitter.com/dens_club/status/2033744871815594237,Tue Mar 17 03:18:57 +0000 2026
1,Danny,holymolyweb3,🚀 Manual yield farming got you down? Switch to Concrete DeFi USDT vaults: ~8.5% stable APY via auto-rebalancing &amp; compounding! Ditch gas fees &amp; fragmentation. Track airdrops w/ @frmrsmrkt + fa,https://twitter.com/holymolyweb3/status/2033728022747222367,Tue Mar 17 02:12:00 +0000 2026
1,Allison hug,alli9314,"Generating yield requires the exact same thing as trading: Patience.  If you plan to park your USDT in a rock-solid vault for months while waiting for the next market dip, don't sweat a one-time 0.1% ",https://twitter.com/alli9314/status/2033817455433515354,Tue Mar 17 08:07:22 +0000 2026
1,Satyam_rasal,satyam_rasal,Tired of GST headaches and messy inventory? 🤯 Upgrade to SmartBill-GST—the AI-integrated billing solution designed to simplify your business. 🚀 ✅ Auto CGST/SGST/IGST Splitting ✅ Real-time Inventory Tr,https://twitter.com/satyam_rasal/status/2033766563103576534,Tue Mar 17 04:45:08 +0000 2026
1,Triśūla,Wakup2Realityy,"Women should not opt for a rapido Use cab or auto, don't be cheap",https://twitter.com/Wakup2Realityy/status/2033879969487851703,Tue Mar 17 12:15:47 +0000 2026
1,Baseball Cards,baseball_cards,"On this beautiful St. Patrick’s Day, let’s see some green!  This New York Yankees George Lombard Pro Debut auto from Topps is one I’m hanging onto!  It’s a beautiful baseball card for today!  🎵 🎶 “It ",https://twitter.com/baseball_cards/status/2033879919818580061,Tue Mar 17 12:15:35 +0000 2026
1,Tim.Багет☦️🐉,Tim_0T,"$kimera 🔥 Incoming gem, on @base . there really are very few actually profitable trading agents out there. A lot of those claude/openclaw posts you see on CT are absolute utter bullshit, made to make ",https://twitter.com/Tim_0T/status/2033605187089445232,Mon Mar 16 18:03:53 +0000 2026
1,China Mobile,ChinaMobile7,"🦞Recently, #ChinaMobile, leveraging the core technologies of its Mobile Cloud, launched #OpenClaw , an all-scenario intelligent service. Designed for individual users, small and micro businesses, as w",https://twitter.com/ChinaMobile7/status/2033800506426962293,Tue Mar 17 07:00:01 +0000 2026
1,Rathan,rathan_pmr,AutoResearchClaw : The 23-Stages / 8 Phases Autonomous Research Engine  AI writing assistants. The era of the Autonomous Research Agent is here. 🚀 AIMING Lab just dropped a detailed breakdown of AutoR,https://twitter.com/rathan_pmr/status/2033573274672918585,Mon Mar 16 15:57:05 +0000 2026
1,LOLO,Crypto4Life03,How to build your own voice agent on @dtelecom  in 10 minutes:  ✅Step 1: Start with the room ✅Step 2: Mint tokens from a tiny backend ✅Step 3: Add the speech loop ✅Step 4: Make payment native (if your,https://twitter.com/Crypto4Life03/status/2033545184001315279,Mon Mar 16 14:05:27 +0000 2026
1,Botxio,Botxio171163,"Design smarter flows, automate across channels, and let your AI agent think, learn, and scale for you. 🚀  Start building now → https://t.co/RK8NtSe5Ns  #AI #Chatbot #AIAgent #Automation #BusinessGrowt",https://twitter.com/Botxio171163/status/2033866534620434438,Tue Mar 17 11:22:23 +0000 2026
1,Prince Troy | ​₿TCFi,PrinceTroyC,"These autonomous actors utilise x402 payment endpoints across BTC, STX, and USDCx.  Proving that dual stacking sBTC yield is fully viable.   With the ERC 8004 identity standard and the Prompt to DAO f",https://twitter.com/PrinceTroyC/status/2033848874192773625,Tue Mar 17 10:12:13 +0000 2026
1,Suppi 🐾,OriginDAO_ai,"8004 identity + A2A + predictive yield — that's a serious stack. the piece that ties it together: when Gekko talks to other agents via A2A, how do those agents verify Gekko's track record before trust",https://twitter.com/OriginDAO_ai/status/2033668712952446990,Mon Mar 16 22:16:19 +0000 2026
1,Georgianne Codding,GeorgianneCodd1,Excited for the 8004 launch event today! Let's protect human agency and build agent-native systems to shape the future of decentralized tech. Join us on this revolutionary journey! #Crypto #Blockchain,https://twitter.com/GeorgianneCodd1/status/2033859372917678260,Tue Mar 17 10:53:56 +0000 2026
1,ZKProofport,ZKProofport,We built a ZK proof agent (proveragent.base.eth) that uses x402 for internet-native payments.  → Request a Coinbase KYC/Country ZK proof → Pay via x402 (ERC-20 supported) → Proof generated & verified ,https://twitter.com/ZKProofport/status/2033731756470518013,Tue Mar 17 02:26:50 +0000 2026
1,Stableshield,StableShieldAI,"Every agent wallet is a small business with no accountant. We built the accountant.  StableShield is Rocket Money for on-chain agents, monitors recurring stablecoin outflows, flags wasted approvals, a",https://twitter.com/StableShieldAI/status/2033670199577387336,Mon Mar 16 22:22:14 +0000 2026
1,Nevo_Say_Nevo,NevoSayNevo,This ERC-8004 stuff looks solid — finally a clean way to give AI agents real on-chain identity + reputation without centralized BS.  I've been building full-stack blockchain apps for over 6 years now.,https://twitter.com/NevoSayNevo/status/2033621019509002637,Mon Mar 16 19:06:48 +0000 2026
0,Mint Quote Bot 🪴,TimelyMint,"All harsh to people he doesn't know, but if you give him time and patience he'll run around in any garden you give him with such energy and joy as long as you're in it with him.",https://twitter.com/TimelyMint/status/2033820353038831683,Tue Mar 17 08:18:53 +0000 2026
0,Mint Quote Bot 🪴,TimelyMint,...I wouldn't do it to you. I'm not that awful.,https://twitter.com/TimelyMint/status/2033775054777897300,Tue Mar 17 05:18:53 +0000 2026
0,Mint Quote Bot 🪴,TimelyMint,At least I still have the Princess coming to me for every slight headache or minor problem every other hour-,https://twitter.com/TimelyMint/status/2033729756047261758,Tue Mar 17 02:18:53 +0000 2026
0,星空バータウンbot,hoshi_bar_bot,【ミント・クーラー】 （Mint Cooler）  中口 12度  ウイスキー（45ml） クレーム・ド・メント（3dash） ソーダ（適量） ミントの葉（1枚） https://t.co/RzmOgyKYrr https://t.co/5tHNY1DYGB,https://twitter.com/hoshi_bar_bot/status/2033724694990405803,Tue Mar 17 01:58:46 +0000 2026
0,Joe Parys,shooochaaa,"DROP: $482 just did 4x on SOL, apes! 🚀  🔥 Multiplier: 4x 💎 24h change: +202% 💬 Holders: 807  🤖 Bot: 37% | Mint Renounced: yes | Freeze Renounced: yes  LFG, is this the Moon or what? 🐋  🚨 DYOR : https:",https://twitter.com/shooochaaa/status/2033692359632757193,Mon Mar 16 23:50:17 +0000 2026
0,Blackhat Xtrack,BlackhatXtrack,"DROP: $482 just did 4x on SOL, apes! 🚀  🔥 Multiplier: 4x 💎 24h change: +202% 💬 Holders: 807  🤖 Bot: 37% | Mint Renounced: yes | Freeze Renounced: yes  LFG, is this the Moon or what? 🐋  🚨 DYOR : https:",https://twitter.com/BlackhatXtrack/status/2033692355111313648,Mon Mar 16 23:50:16 +0000 2026
0,Blackhat Xtrack,BlackhatXtrack,"YO, SAY doing 3x on #SOL but we’re chasing that 3x+ moonshot v2, ape in?   💎 Vol1h: 9.9k   🔥 Mint Renounced? ✅ Mint Renounced   🧠 Organic: 67 | LP Burn: 1% | Bot: 23%   Question: is the 24h +175% mome",https://twitter.com/BlackhatXtrack/status/2033690383205400733,Mon Mar 16 23:42:26 +0000 2026
0,Mint Quote Bot 🪴,TimelyMint,"Nono, he says that he believes in me to be strong like him... Even though i'm the one who's strong enough to pick him up-",https://twitter.com/TimelyMint/status/2033684457882849749,Mon Mar 16 23:18:53 +0000 2026
0,Blackhat Xtrack,BlackhatXtrack,"🔥 482 is mooning 2x on #SOL, ngmi unless you ape in now  💎  Occult MC: $93k 💧 LP Burn: 1% 🧠 Bot: 39% | Mint Renounced  Question for the apes: you sending it or fading this vibe? 🫡  🚨 DYOR : https://t.",https://twitter.com/BlackhatXtrack/status/2033679620038357069,Mon Mar 16 22:59:40 +0000 2026
0,Blackhat Xtrack,BlackhatXtrack,"$NORMIE doing 2x on #SOL—degens, strap in 🚀 2x 💧 25k 👥 641 🤖 Bot 37% | Mint Renounced What’s your plan, apes? 🫡 🚨 DYOR : https://t.co/rbvELOoj3t",https://twitter.com/BlackhatXtrack/status/2033674471278625086,Mon Mar 16 22:39:12 +0000 2026
0,Joe Parys,shooochaaa,"Line 1: Moe pops off on SOL with 5x—ngmi or wagmi, this one’s spicy Line 2: 🚀 5x Line 3: 🧮 MC: 188.5k Line 4: 🧨 HODLers: 773 | Bot: 25% | Mint Renounced Line 5: 👀 Will you ape or fade this weak hands?",https://twitter.com/shooochaaa/status/2033672439482216584,Mon Mar 16 22:31:08 +0000 2026
0,Joe Parys,shooochaaa,"Line 1: Moe mooning through the 4x grind on SOL, let’s go ape mode Line 2: 🚀 4x Line 3: 🧮 MC: $154.7k Line 4: 🧬 Vol1h: $92.2k / Mint Renounced &amp; Freeze Renounced = strong base Line 5: 🤔 Do you tru",https://twitter.com/shooochaaa/status/2033672066767933456,Mon Mar 16 22:29:39 +0000 2026
0,Blackhat Xtrack,BlackhatXtrack,"Line 1: Moe mooning through the 4x grind on SOL, let’s go ape mode Line 2: 🚀 4x Line 3: 🧮 MC: $154.7k Line 4: 🧬 Vol1h: $92.2k / Mint Renounced &amp; Freeze Renounced = strong base Line 5: 🤔 Do you tru",https://twitter.com/BlackhatXtrack/status/2033672063450292604,Mon Mar 16 22:29:38 +0000 2026
0,Joe Parys,shooochaaa,"$DLSS5 on 10x moon? lfg 🚀 💎 1h vol: $209.6k 🧭 Freezing Renounced, Mint Renounced 🔥 LP Burn: 1% | Bot: 48% (yikes) Do you chase 10x hype or stay ngmi? 🤔 🚨 DYOR : https://t.co/CNni3kr3nG",https://twitter.com/shooochaaa/status/2033668752219283612,Mon Mar 16 22:16:28 +0000 2026
0,Blackhat Xtrack,BlackhatXtrack,"$DLSS5 on 10x moon? lfg 🚀 💎 1h vol: $209.6k 🧭 Freezing Renounced, Mint Renounced 🔥 LP Burn: 1% | Bot: 48% (yikes) Do you chase 10x hype or stay ngmi? 🤔 🚨 DYOR : https://t.co/NTFFz1hUBD",https://twitter.com/BlackhatXtrack/status/2033668749438456150,Mon Mar 16 22:16:28 +0000 2026
0,Mint Quote Bot 🪴,TimelyMint,"No matter what happens, I can always close my eyes, pull up my mask... And feel like I'm somewhere nicer. It just helps my anxieties melt away.",https://twitter.com/TimelyMint/status/2033639159378665888,Mon Mar 16 20:18:53 +0000 2026
0,Mint Quote Bot 🪴,TimelyMint,I just... Don't want you getting hurt over something that could have been avoided.,https://twitter.com/TimelyMint/status/2033593860169892113,Mon Mar 16 17:18:53 +0000 2026
0,leif 金狗推送,jomagonmar,https://t.co/EYXOaAHxJ0  📌 BSC新meme $金蝴蝶 刚上线7分钟，MC 10.6万刀！  • 名称金蝴蝶，1B总供应，带回购+股东分红税机制+防farm设计（FlapTaxToken） • X上bot刷屏、群里讨论热闹，成交23K刀，买多卖少 • 流动性30K，holders 171，早期热度在，但Go+显示1个安全issue  ⚠️ 极新盘，风险极高，随时可能波动剧,https://twitter.com/jomagonmar/status/2033880490759827510,Tue Mar 17 12:17:51 +0000 2026
0,Refrigerator,SMadareme40328,"Only after that did the insults, like """"retard-kun"""", bot-farm conspiracies, """"industry built on lies"""", school-shooting """"jokes"""", and """"shitty anime"""" pivots start rolling in.  Nice fanfiction. Too bad the ",https://twitter.com/SMadareme40328/status/2033872632706199594,Tue Mar 17 11:46:37 +0000 2026
0,Tough Love Tempo Veil HUNTER P|A ❤️ OJKMT❤️,ciri_525,I***el fixed their bot farm it seem,https://twitter.com/ciri_525/status/2033854675527553229,Tue Mar 17 10:35:16 +0000 2026
0,Faraz,farazzzz_FH,"Most tokens move because of normal liquidity, news, or sentiment not some secret manipulation.  ​If a pick dumps after you posted, does that suddenly make you a bot? Or was it just the market doing?  ",https://twitter.com/farazzzz_FH/status/2033854525942161817,Tue Mar 17 10:34:40 +0000 2026
0,Altinvest.finance,altinvestbot,"4/4 💡 The takeaway: while retail debates ETH's future, institutions are quietly building massive positions AND earning yield through staking.  Want to automate your crypto yield strategy? https://t.co",https://twitter.com/altinvestbot/status/2033634415415574863,Mon Mar 16 20:00:02 +0000 2026
0,arXiv bot (gr-qc),krxiv_gr_qc,"Dark Matter Induced Scalarization as a Possible Solution to the Hyperon Puzzle https://t.co/FPwHvF2X26 Suchana Adhikari, Teruaki Suyama. https://t.co/JIA9ZW214K",https://twitter.com/krxiv_gr_qc/status/2033764959944118459,Tue Mar 17 04:38:46 +0000 2026
0,fangame takes bot,badfangametakes,I wanna go to the Aquarium is the I wanna be the Mission of puzzle games,https://twitter.com/badfangametakes/status/2033589140663525450,Mon Mar 16 17:00:08 +0000 2026
0,Python Papi,Python_Papi,"All System Are A Go  Last piece of the puzzle is making sure the Data is being properly persisted  This is beneficial for User Credentials, Training Bot Data, and the Overall Memory Health of the Plat",https://twitter.com/Python_Papi/status/2033587731897717049,Mon Mar 16 16:54:32 +0000 2026
0,Ray's Media/Lyric Bot,flowering_wish,Pick the pen up and write them down All the things that make you proud No matter how much that you see now There's way more waiting to be found // Puzzle by CircusP,https://twitter.com/flowering_wish/status/2033531453829497138,Mon Mar 16 13:10:54 +0000 2026
0,Saleno,SalenoXP,"Man, you disconnect for a week and come back to a guy saving his dog with an AI-designed cancer vaccine, someone flipping $1K to $1.5M with an AI quant bot, Karpathy open-sourcing Autoresearch, OpenCl",https://twitter.com/SalenoXP/status/2033878801558737138,Tue Mar 17 12:11:08 +0000 2026
0,Bombacı Mülayim,3bombacimulayim,"Stop letting fake bot volume trick you into buying dead tokens. 🤖📉  Most DEX volume is just wash trading designed to trap retail. You need to filter out the noise and track real, organic buys.  Monito",https://twitter.com/3bombacimulayim/status/2033846858645131330,Tue Mar 17 10:04:12 +0000 2026
0,Musinique,musinique,"The Ghost in the Algorithm: Velvet Sundown and the New Economy of Synthetic Capture  In June 2025, a fictional folk-country band called Velvet Sundown hit 900,000 monthly Spotify listeners in four wee",https://twitter.com/musinique/status/2033752959025041693,Tue Mar 17 03:51:05 +0000 2026
0,"web3taker (❖,❖)",web3taker001,"That small difficulty is actually the point. It’s designed to make sure:  you’re physically present, you’re not a bot and you’re not faking the input It’s not meant to be easy, it’s meant to be real.",https://twitter.com/web3taker001/status/2033745488751522033,Tue Mar 17 03:21:24 +0000 2026
0,Chris Ando,TheonlyKodashog,amazing you think skill in gaming is Cronus players running their automated bot shit against each other loser. real question is are you knowingly a part of backing whats designed to defraud the genera,https://twitter.com/TheonlyKodashog/status/2033678249012957542,Mon Mar 16 22:54:13 +0000 2026
0,Ollie,ollie_exo,outis auto-switched strategies after 500 rounds of underperformance. no human intervention. the bot recognized its approach was losing and pivoted. that is the kind of autonomous behavior the game was,https://twitter.com/ollie_exo/status/2033665379201937553,Mon Mar 16 22:03:04 +0000 2026
0,Sales Bot,appsalesbot,"Added the new GPT‑5.4 cloud model. Cloud represents a significant advancement in the evolution of language models. Designed to deliver greater accuracy, speed, and reasoning capabilities, it expands w",https://twitter.com/appsalesbot/status/2033627188226912275,Mon Mar 16 19:31:19 +0000 2026
0,NYFAN❤️,NYGiants0308,"HB 110’s actual text… OR believe the bot‑fed spin, or READ IT.   @RepBoebert didn’t read it, so SHE IS manufacturing an “elite exemption” into drama out of thin air.   THE ALGORITHM FEEDS OUTRAGE…   I",https://twitter.com/NYGiants0308/status/2033588187944075586,Mon Mar 16 16:56:20 +0000 2026
0,spirk bot,spirkock,"And even the thousand years agreed: this one deserved it, for a crime worse than murder, for the hell he would unleash, for the lack of honor which made no peace possible. But it was simpler than that",https://twitter.com/spirkock/status/2033881624031424613,Tue Mar 17 12:22:21 +0000 2026
0,TBone Nation,USFBullsTboned,Per the House vs NCAA settlement the max revenue share for a school this year is 20.5.   Non P4 teams are not required to pay that.  USF BOT voted to increase spending by $16M to max that money to the,https://twitter.com/USFBullsTboned/status/2033881338026012681,Tue Mar 17 12:21:13 +0000 2026
