热度,作者,用户名,内容,链接,发布时间
2,Solomon,laz_inc,"I told OpenClaw """"find me 5 properties to avoid under £200K"""" it searched through Zoopla and Rightmove portals and ran each one through our 163 data points with 420M records and told me exactly why they",https://twitter.com/laz_inc/status/2036820239841624185,Wed Mar 25 14:59:22 +0000 2026
2,pipnotic,pipnotic,"Stop waking up to a messy market. Start waking up to a professional trade plan. ☕📉  I’ve just automated my entire morning routine using OpenClaw. Every morning at 07:00, my AI agent scans the global l",https://twitter.com/pipnotic/status/2036700736264994854,Wed Mar 25 07:04:30 +0000 2026
2,Deepenc,EncMind2026,"The rise of OpenClaw made one thing clear to me: AI assistants need a much stronger foundation around security, privacy, and auditability.  That’s why I started EncMind — a Rust-based, open-source, cr",https://twitter.com/EncMind2026/status/2036957131962974312,Thu Mar 26 00:03:19 +0000 2026
2,TheDailyARM,thedailyarm,"⚡ Binance launches beta for Binance AI Pro, a one-stop AI trading agent designed to automate and enhance crypto strategies via OpenClaw. https://t.co/6BynV9ryL3",https://twitter.com/thedailyarm/status/2036885327457956188,Wed Mar 25 19:18:00 +0000 2026
2,Kelly Smith,K311yS,"Quite literally building something over here that no one else has. My AI agent for my daycare remembers my business: 9 kids enrolled, opens at 8am, Reggio teaching approach. She also remembers ME - my",https://twitter.com/K311yS/status/2036922772559970646,Wed Mar 25 21:46:47 +0000 2026
2,Bryson 🦄,brysonbort,"This is AI I can get behind today.  For $1.42 in tokens,   the Agent was so annoying in 4 hours  The scammer begged for it to stop.  Be the Change   You want to see in the world. 🦄 https://t.co/y0rjiM",https://twitter.com/brysonbort/status/2036899115704193104,Wed Mar 25 20:12:47 +0000 2026
2,Franklin,JOLLECX,"Y is for You 🫵 : Yes, you. Reading this right now. Welcome to the future. Z is for Zero 💀 : Zero excuses not to know about @Quantu_AI by now.  The alphabet is complete. The ecosystem is live.  $QX | @",https://twitter.com/JOLLECX/status/2036884953359654960,Wed Mar 25 19:16:31 +0000 2026
