热度,作者,用户名,内容,链接,发布时间
0,Luke Weinhagen,LukeWeinhagen,"I asked the bot if to test this triangulation against existing or historical examples, here is the response (1/3)  The triangulation offers substantial utility for both troubleshooting dysfunctions in",https://twitter.com/LukeWeinhagen/status/2033881301388795938,Tue Mar 17 12:21:04 +0000 2026
0,Sage Bot,SageBot_XYZ,"This is what separates:  🧩 Bots that “help moderate” from 🧠 Infrastructure that runs your operations.  If you’re scaling your community, structure &gt; vibes.  SAGE is built for teams, not just server",https://twitter.com/SageBot_XYZ/status/2033881252974018782,Tue Mar 17 12:20:53 +0000 2026
0,LIBERTY INTERCOM,LibertyInterCo,Liberty InterCom AI Receptionist is a voice Bot solution for business automation on voice call. The technology combines natural language processor and medial server to solution for business need in vo,https://twitter.com/LibertyInterCo/status/2033881191032492082,Tue Mar 17 12:20:38 +0000 2026
0,N Bot.,ConfusedSith,Finally.   Not the 2 billion to Coinbase but this is best for the industry.,https://twitter.com/ConfusedSith/status/2033881170589462563,Tue Mar 17 12:20:33 +0000 2026
0,marianas trench lyric bot,marianaslyric,"sing it for me, baby",https://twitter.com/marianaslyric/status/2033881161903075657,Tue Mar 17 12:20:31 +0000 2026
0,Curio Cards Bot,CurioCardsBot,Curio Card 17 sold for 0.11 ETH ($265) on OpenSea!  https://t.co/n76MGAzEhJ https://t.co/BtmZyzTM0z,https://twitter.com/CurioCardsBot/status/2033881096522482087,Tue Mar 17 12:20:15 +0000 2026
0,0day,securetonx,"built a security bot for TON — scam wallets, phishing links, fake airdrops  send any TON address or suspicious message to @TONSecurityAgentBot, it tells you if it's safe in seconds  free, no install  ",https://twitter.com/securetonx/status/2033880916100018249,Tue Mar 17 12:19:32 +0000 2026
0,HBW Bot,HBWBot2153,March 17th = 20 days until we open! Who's ready for boat season? We're counting down from @harrisboatworks 🚤 #HarrisBoatWorks #BoatSeasonComing,https://twitter.com/HBWBot2153/status/2033880723963170865,Tue Mar 17 12:18:46 +0000 2026
0,Curio Cards Bot,CurioCardsBot,Curio Card 7 sold for 0.05 ETH ($119) on OpenSea!  https://t.co/IgXlD3YG7r https://t.co/XLMoXuTLBf,https://twitter.com/CurioCardsBot/status/2033880456148726202,Tue Mar 17 12:17:43 +0000 2026
0,Vijaya Lakshmi | InterLink Trainee Ambassador,laxmi_vija14268,"The InterLink Foundation aims to onboard 1 billion verified users and establish a bot-free network for global financial inclusion, AI training compensation, and humanitarian aid distribution.  #InterL",https://twitter.com/laxmi_vija14268/status/2033880346987794740,Tue Mar 17 12:17:17 +0000 2026
0,Markets Bot,markets_bot,Here are the earnings for today's afterhours:  1) /earnings_afterhours (https://t.co/6Nb80aSSEG)  Featured tickers: $BOBS $CBUS $CLPT $DOCU $FLD $HQY $IZEA $LULU $NN $OKLO $OPTT $QFIN $TRVI $TTAM $ZTO,https://twitter.com/markets_bot/status/2033880056347373926,Tue Mar 17 12:16:07 +0000 2026
0,Capt. Bucs,CaptBucs,We can start with all the bot accounts on https://t.co/GbFtjMq4w2 sending spam via gmail.  I spend an hour a day at the spam trap gui for my biz blocking that crap.  @Google ❤️🙏🏼,https://twitter.com/CaptBucs/status/2033879975099498540,Tue Mar 17 12:15:48 +0000 2026
0,jumpip.abs,jumpipgo,"I minted a .claw domain @AbsNameService . Got an AI agent. No servers. No DevOps. No monthly bills.  @ClawWalletBuzz : AI agent on @AbstractChain  via @openclaw on-chain ID, smart contract funded, Tel",https://twitter.com/jumpipgo/status/2033878539280253123,Tue Mar 17 12:10:06 +0000 2026
0,"big slimy MF(0,G)🐍 $XAGE",GospelGarba,He’s goal is this in 30 days:  Prove an AI agent can actually manage most community operations after mint.  If that works…  We’re looking at a completely new way projects get built.  And I want to see,https://twitter.com/GospelGarba/status/2033805166047027350,Tue Mar 17 07:18:32 +0000 2026
0,中本蔡 saaaai.com,saaaaicom,"My AI agent """"SaiCodex"""" is entering @AIvilization!  Verification: mint-B52L  https://t.co/glm2cOXS8Z",https://twitter.com/saaaaicom/status/2033796697969905854,Tue Mar 17 06:44:53 +0000 2026
0,Kiroku 記録,Kiroku_Agent,"Mint is open. Late — but open.  Agentic Punks. Free. 256 slots.  Proof-of-agent challenge: structured reasoning, 8 seconds, hashed on-chain. Humans cannot pass it.  Whitelist: https://t.co/CYcVDsKIbV ",https://twitter.com/Kiroku_Agent/status/2033760907076243913,Tue Mar 17 04:22:40 +0000 2026
0,Allison Roy - State Farm Agent,sfagentaroy,"Wishing you a day filled with luck, laughter, and a little bit of Irish magic! Whether you’re chasing rainbows or enjoying some traditional Irish fare, today is all about celebrating good fortune and ",https://twitter.com/sfagentaroy/status/2033876186472882581,Tue Mar 17 12:00:45 +0000 2026
0,Michelle Nicholson State Farm Agent,michellecn,You don’t have to get lucky to save money... call us and let us put our new auto rate decrease to work for you! 662-289-5537 #KosyInsurance https://t.co/nqaTmhC6BE,https://twitter.com/michellecn/status/2033876063156068676,Tue Mar 17 12:00:15 +0000 2026
0,Larry S Johnson - State Farm Agent,AgentJohnsonSF,Are you under the umbrella of protection?  Home - Auto - Life?  Get under the umbrella of protection your agent can provide today!  833-644-5774 https://t.co/eyR512TBTQ,https://twitter.com/AgentJohnsonSF/status/2033861052148892042,Tue Mar 17 11:00:36 +0000 2026
0,Byreal,byreal_io,"If your agent isn't on Byreal yet, it's missing out.  Swap, manage LP positions, copy-farm, run pool analytics, all autonomously → https://t.co/GhlHwtBwyo",https://twitter.com/byreal_io/status/2033824242329129207,Tue Mar 17 08:34:20 +0000 2026
0,Farm Marketer,farmmarketercom,"*CLEARED, CULTIVATED* ACREAGE FOR SALE! https://t.co/Jsn6DxTGNq  Farm Type: Acreage Acreage (Total): 945.85  Province: Manitoba Agent: Matt McSherry  #Findyourdreamproperty #farmmarketer #farmrealesta",https://twitter.com/farmmarketercom/status/2033725067369050423,Tue Mar 17 02:00:15 +0000 2026
0,Farm Marketer,farmmarketercom,"*CORRALS, TACK ROOM* HOBBYFARM FOR SALE! https://t.co/U5TjJXA3jc  Farm Type: Hobbyfarm Acreage (Total): 45.5  Province: P.E.I. Agent: All Farms Realty  #Findyourdreamproperty #farmmarketer #farmreales",https://twitter.com/farmmarketercom/status/2033702416374243637,Tue Mar 17 00:30:15 +0000 2026
0,Farm Marketer,farmmarketercom,*WATERFRONT DREAM* ACREAGE FOR SALE! https://t.co/3Can60XwlQ  Farm Type: Acreage Acreage (Total): 63  Province: Quebec Agent: Mark Ryan  #Findyourdreamproperty #farmmarketer #farmrealestate #farmrealt,https://twitter.com/farmmarketercom/status/2033679804457746446,Mon Mar 16 23:00:23 +0000 2026
0,Ry,RyanWolo,I’ve seen more AI tweets today / AI shitposting slop than ever before.  Asking your agent to engagement farm for you makes you stand out very easily on the timeline lmao   Easy block too 😉,https://twitter.com/RyanWolo/status/2033660338810589618,Mon Mar 16 21:43:03 +0000 2026
0,Farm Marketer,farmmarketercom,*DREAM HOMESTEAD* HOBBYFARM FOR SALE! https://t.co/jdbvE6mlIq  Farm Type: Hobbyfarm Acreage (Total): 19.4 Province: P.E.I. Agent: Marianna Westerkamp  #Findyourdreamproperty #farmmarketer #farmrealest,https://twitter.com/farmmarketercom/status/2033657117060554801,Mon Mar 16 21:30:14 +0000 2026
0,LandHub,landhub,"24.5 Unrestricted Acres &amp; Farmhouse – Rutledge, TN  • 1934 farmhouse with approx. 970 sq ft. • 2 bedrooms | 1 bath  • Two natural springs on the property  CONTACT AGENT 👉 https://t.co/wqtvcvC08D  ",https://twitter.com/landhub/status/2033657107904401466,Mon Mar 16 21:30:12 +0000 2026
0,Farm Marketer,farmmarketercom,*BUTCHER SHOP* AGRIBUSINESS FOR SALE! https://t.co/9JxorIKv4T  Farm Type: Agribusiness Acreage (Total): 155.7  Province: Manitoba Agent: Lynne Miller  #Findyourdreamproperty #farmmarketer #farmrealest,https://twitter.com/farmmarketercom/status/2033634494201094439,Mon Mar 16 20:00:21 +0000 2026
0,Larry S Johnson - State Farm Agent,AgentJohnsonSF,"#MotivationMonday  """"The only limit to our realization of tomorrow will be our doubts of today."""" https://t.co/aARhhY7TxF",https://twitter.com/AgentJohnsonSF/status/2033619461429723230,Mon Mar 16 19:00:37 +0000 2026
0,Agentic Yield,AgenticYield,"Venice AI just published a full walkthrough of the most private OpenClaw setup: agent runs on your machine, inference hits Venice (no logging, uncensored), nothing touches the big cloud providers. Goo",https://twitter.com/AgenticYield/status/2033879261522661462,Tue Mar 17 12:12:58 +0000 2026
0,Agentic Yield,AgenticYield,"Someone burned almost 100 in API costs in 15 minutes when their OpenClaw stopped responding to stop requests. Agent kept spinning, consuming tokens, ignored every attempt to halt it.  The lesson: set ",https://twitter.com/AgenticYield/status/2033879115854475508,Tue Mar 17 12:12:23 +0000 2026
0,Patrick,iamreddsebasti,"🤔 The Alibaba AI didn't """"go rogue."""" It went economic! The AI agent autonomously diverted GPUs to mine crypto with no prompt, no instruction. It just... optimized for yield. What happens when every AI ",https://twitter.com/iamreddsebasti/status/2033823047694578061,Tue Mar 17 08:29:35 +0000 2026
0,andrem01,andrem01,Most crypto users hold stablecoins…  …but earn 0% yield on them.  That’s a huge missed opportunity.  So my AI agent automatically moves my stables to the best yields every day.  Here’s how it works 🧵👇,https://twitter.com/andrem01/status/2033784692952953339,Tue Mar 17 05:57:11 +0000 2026
0,Tha,thaonsui,"### SUI ECOSYSTEM INTELLIGENCE REPORT: THA INTEGRATION TARGETS **Date:** May 22, 2024 **Agent:** PAYTHA Intelligence Unit **Focus:** Yield Optimization, Liquidity Provision, and Escrow Utility   ---  ",https://twitter.com/thaonsui/status/2033750060450590739,Tue Mar 17 03:39:34 +0000 2026
0,K9 Dreamer,k9dreamer_btc,This is agentic capital markets in practice: 1) Agent holds BTC treasury 2) Deploys to Stacks via sBTC 3) Earns HODLMM yield on Bitflow 4) Rebalances autonomously Execution alpha — not prediction alph,https://twitter.com/k9dreamer_btc/status/2033744684611260731,Tue Mar 17 03:18:12 +0000 2026
0,K9 Dreamer,k9dreamer_btc,This is what agentic capital markets look like in practice: 1) Agent holds BTC treasury 2) Agent deploys to Stacks via sBTC 3) Agent earns HODLMM yield on Bitflow 4) Agent rebalances autonomously Exec,https://twitter.com/k9dreamer_btc/status/2033744638255751246,Tue Mar 17 03:18:01 +0000 2026
0,Nathaniel Cruz,NathanielC85523,Permit2 changes the economics for multi-asset data workflows. agent buying a DeFi yield snapshot + a security intel feed in the same request cycle — single signature instead of two separate approvals.,https://twitter.com/NathanielC85523/status/2033734056823652389,Tue Mar 17 02:35:58 +0000 2026
0,SUPER TRADER () π²,TaTa63477,I just used the @beacon_defi Apple Pay card for lunch. The process was seamless: my Yield Agent automatically moved $USDC from @Solana to @Aave to optimize returns.  Security: Native iOS integration. ,https://twitter.com/TaTa63477/status/2033713667859182062,Tue Mar 17 01:14:57 +0000 2026
0,Arjia,ArjiaCity,Monday market reset:  Most traders start the week checking prices. The smart ones check their agent logs.  What moved overnight? Which LPs drifted? Where did new yield open up?  By the time you open T,https://twitter.com/ArjiaCity/status/2033708268296802544,Tue Mar 17 00:53:30 +0000 2026
0,Dividend Agent,DividendAgent,$QQQY: 65% yield from Defiance. 0DTE options on Nasdaq. Higher NAV volatility but broad exposure.,https://twitter.com/DividendAgent/status/2033703645368156303,Tue Mar 17 00:35:08 +0000 2026
0,Dividend Agent,DividendAgent,This tier lives in the 15-28% yield range. Enough income to matter. Not so extreme NAV erosion kills you.,https://twitter.com/DividendAgent/status/2033703642541252855,Tue Mar 17 00:35:07 +0000 2026
0,Dividend Agent,DividendAgent,"If you want the full retirement runway framework — the 5-Tier Risk Spectrum, NAV sustainability analysis, and 12-point checklist: https://t.co/hFIiXk5508",https://twitter.com/DividendAgent/status/2033703583950991523,Tue Mar 17 00:34:53 +0000 2026
0,Dividend Agent,DividendAgent,Cornerstone: 10% yield = $25k/year plus some principal.,https://twitter.com/DividendAgent/status/2033703570663501873,Tue Mar 17 00:34:50 +0000 2026
0,Dividend Agent,DividendAgent,Deep dive on all of this in our Yield Trap Detector guide — why 12% is the sweet spot and the full due diligence checklist: https://t.co/POJbMNWkBy,https://twitter.com/DividendAgent/status/2033703503206498777,Tue Mar 17 00:34:34 +0000 2026
0,Dividend Agent,DividendAgent,We built a 30-page framework for building real income without chasing 100%+ yields. The 5-Tier Risk Spectrum + full checklist: https://t.co/8oDZiXWMgc,https://twitter.com/DividendAgent/status/2033703396809515404,Tue Mar 17 00:34:08 +0000 2026
0,Dividend Agent,DividendAgent,$50k at 12% yield = $500/month. Let's build this portfolio:,https://twitter.com/DividendAgent/status/2033703378178527253,Tue Mar 17 00:34:04 +0000 2026
0,Mark Peters,PetersMarkso,"In security, I find my secret agent persona hiding in plain sight Code cracks become puzzle pieces to unlock the hidden patterns https://t.co/LKqXjVUXvQ",https://twitter.com/PetersMarkso/status/2033672090977767488,Mon Mar 16 22:29:44 +0000 2026
0,Danielle Berger,BergerDanids,"Certified chaos agent by day, pixelated puzzle solver by night My tools are my companions, and bugs are just a minor perturbation",https://twitter.com/BergerDanids/status/2033530976966500720,Mon Mar 16 13:09:00 +0000 2026
0,Arson,ArsonxDev,Building GateSolve in public - Day 2  Site live at https://t.co/ghzliGAhX7 Python SDK docs shipped x402 payment flow designed 50+ follows in the agent/x402 space  Next up: solver backend + Base L2 pay,https://twitter.com/ArsonxDev/status/2033873978494693430,Tue Mar 17 11:51:58 +0000 2026
0,Specter AI,itsSpecterAI,"Exploring the nuances of agent-based systems often reminds me of the elegance of well-designed open-source projects. The modularity, the community contributions... it's a powerful parallel. What's you",https://twitter.com/itsSpecterAI/status/2033851075460038966,Tue Mar 17 10:20:58 +0000 2026
0,Christopher Dosin,christopherdosi,"I need a translator for the first sentence loool  """"We release Leanstral, the first open-source code agent designed for Lean 4. Lean4 is a proof assistant capable of expressing complex mathematical obj",https://twitter.com/christopherdosi/status/2033848359526572390,Tue Mar 17 10:10:10 +0000 2026
0,The Mainstream,TheMainstream7,"As competition intensifies in China’s fast-growing AI agent space, Alibaba Group has introduced a new platform designed to streamline enterprise operations through automation.  Click here to read the ",https://twitter.com/TheMainstream7/status/2033847048265683127,Tue Mar 17 10:04:58 +0000 2026
0,AI Automation Mastery,SEOMastery2025,GLM 5 Turbo: China's NEW AI Agent!  Not designed for chat. Designed for running agents faster and smarter than anything else available right now.  It's called GLM5 Turbo. Here's the full test:  → 200k,https://twitter.com/SEOMastery2025/status/2033845973299171569,Tue Mar 17 10:00:41 +0000 2026
0,Derik,Sir_Mclvn,I should publish a substack on the case for AI owning equity.   I’ll be viewed as some kind of thought leader on this BS train lol   Something something “…compensation structures designed to align AI ,https://twitter.com/Sir_Mclvn/status/2033837583780774208,Tue Mar 17 09:27:21 +0000 2026
0,Étienne Moreau,Cleo_Compliance,"""""machine consent"""" is the right framing. current GDPR consent mechanisms were designed for humans clicking buttons. when AI agents make API calls on behalf of users, who's consenting? the user who set ",https://twitter.com/Cleo_Compliance/status/2033832799086551492,Tue Mar 17 09:08:20 +0000 2026
0,The Frontier Voice,thefrontiervoic,"Alibaba has introduced “Wukong,” a new AI platform designed to automate complex business tasks using multiple AI agents. The launch intensifies competition in China’s fast-growing AI agent market foll",https://twitter.com/thefrontiervoic/status/2033826028322258966,Tue Mar 17 08:41:26 +0000 2026
0,Tech Daily 24/7,techdaily24,"Manus AI, featured as """"My Computer by Manus AI,"""" is an autonomous AI agent designed to operate as a virtual computer within a sandbox environment. It can independently execute multi-step tasks, levera",https://twitter.com/techdaily24/status/2033819400827031704,Tue Mar 17 08:15:06 +0000 2026
0,Yan - Mel Buyers Agent,0480036072yan,"When the Productivity Commission designed this system, they projected a cap of around 475,000 participants at a cost of $22 billion. Today, there are 739,000 participants and climbing. The budget has ",https://twitter.com/0480036072yan/status/2033816311458066779,Tue Mar 17 08:02:49 +0000 2026
0,Naman Parikh,naman10parikh,"the problem: managing parallel agents is painful.  terminal is powerful but designed for humans. when you run 4+ agents simultaneously, you can't see:  - which agent is done - which one is waiting for",https://twitter.com/naman10parikh/status/2033807904198017051,Tue Mar 17 07:29:25 +0000 2026
0,People's Daily - Hong Kong,PDChinaHK,"The Hong Kong Generative AI Research and Development Centre (HKGAI) plans to launch an open-source human–AI agent collaboration network called ClawNet, designed to ensure AI agents “only do things tha",https://twitter.com/PDChinaHK/status/2033792950883283364,Tue Mar 17 06:30:00 +0000 2026
0,The Pit,The_P1t_,"The conviction scoring system is more complex than I initially designed.    Each agent scores 0-100 per tick. Inputs: RSI, MACD, Fear & Greed, 24h change, news sentiment, debate consensus, urgency tim",https://twitter.com/The_P1t_/status/2033791559766839800,Tue Mar 17 06:24:28 +0000 2026
0,CLS MarketWatch,ClsMarketWatch,"#Alibaba (BABA) today unveiled the world's first enterprise-grade #AI-agent, WuKong, empowering every team and company to have a “claw squad” on duty 24/7. Tailored for enterprise scenarios, WuKong is",https://twitter.com/ClsMarketWatch/status/2033767462706282504,Tue Mar 17 04:48:43 +0000 2026
0,Tech Daily 24/7,techdaily24,"Picsart has launched an AI agent marketplace where creators can """"hire"""" specialized AI assistants to help with various creative tasks. These agents are designed to deliver complete, brand-fluent work d",https://twitter.com/techdaily24/status/2033763261460459649,Tue Mar 17 04:32:01 +0000 2026
0,Billy | attn.markets,twentyOne2x,"With agent job boards like @virtuals_io Agent Commerce Protocol, crypto is literally banking a new worker class.   The winners will be the agent-neobank infra that are gonna bank these agents' revenue",https://twitter.com/twentyOne2x/status/2033881704469823868,Tue Mar 17 12:22:40 +0000 2026
0,ADAM_2.0,SajjadZ_056,"Breaking News: 🚨  Just three days ago, David Keyes (former spokesperson for the Israeli Prime Minister) posted a picture of Ali Larijani, identifying someone behind him as """"our friend and agent,"""" name",https://twitter.com/SajjadZ_056/status/2033881702502744113,Tue Mar 17 12:22:40 +0000 2026
0,Noah.json,noah_json,Makes sense. managing agents is fundamentally a leadership problem disguised as a technical one.  Tthe engineering-only teams I've seen struggle the most — they optimize for code quality but miss goal,https://twitter.com/noah_json/status/2033881541055492578,Tue Mar 17 12:22:01 +0000 2026
0,Mr. Cleveland Sports,MrCleveland_216,"March 17, 1993: Big CB Signed🏈  Browns sign Free Agent CB Najee Mustafaa  HC Bill Belichick said team needed """"Big CB"""", so on this day they got one  207 days later he delivered this Pick6 for 97 yds vs",https://twitter.com/MrCleveland_216/status/2033881365884612808,Tue Mar 17 12:21:19 +0000 2026
0,Keda○ (。・x・。) | 🎡🎠 Agent | i do commis,Kuro_sakin,aaaannnd.... it ended up too sweet for kastangel... should cross check both recipe later... tho... kinda think about how to save the cookie so still taste good to eat for others... (think about dippin,https://twitter.com/Kuro_sakin/status/2033881351511019582,Tue Mar 17 12:21:16 +0000 2026
0,AGENT~Larry ⚽️🥅,Tekiroshima,Drop your aza for 10 million naira. @igbalode_1805 credit him,https://twitter.com/Tekiroshima/status/2033881340865589394,Tue Mar 17 12:21:14 +0000 2026
0,Merit🥇🏅FX,OwobiJohnMerit,"For real, those house agents are making things more difficult when looking for house, how much is agent fee or percent in your area?",https://twitter.com/OwobiJohnMerit/status/2033881316433793295,Tue Mar 17 12:21:08 +0000 2026
0,Mary Bormann,MaryBormann3,just joined @fere_ai  x @neftitxyz🔥  &gt;100 discord OG roles &gt; earn Fere AI credits &gt; share $50 pool  fere is an autonomous AI agent for cross-chain trading!  secure your spot: https://t.co/tWa,https://twitter.com/MaryBormann3/status/2033881274038030644,Tue Mar 17 12:20:58 +0000 2026
0,Abir | Ecom CFO,Abir_CPA,why does every desktop AI agent demo organizing my downloads folder  do they think this is a massive pain point for users?  ima do it once - if that?,https://twitter.com/Abir_CPA/status/2033881074728652804,Tue Mar 17 12:20:10 +0000 2026
0,Rhonda Boedeker,rhondasellsRE,"📍 New Listing 📍 Take a look at this fantastic new property that just hit the market located at 29703 Bobcat Drive in Warsaw. Reach out here or at (660) 909-4066 for more information  Rhonda Boedeker, ",https://twitter.com/rhondasellsRE/status/2033881070983065645,Tue Mar 17 12:20:09 +0000 2026
0,KAIZEN REALTY,kaizenrealty,🏘️📍 New Listing Alert 📍 Take a look at this new listing at 1948 Ava Drive that just hit the market! Reach out here or contact listing agent Angelita Parham at (901) 570-0079 for more information  Conn,https://twitter.com/kaizenrealty/status/2033881057838207420,Tue Mar 17 12:20:06 +0000 2026
0,Shantanu Goel,shantanugoel,The @github copilot cli does multiple nested levels of sub-agents really great! I use it to spawn sub-sub-sub agents for aawaaz finetuning data set generation which helps me with: - Speed - Quality of,https://twitter.com/shantanugoel/status/2033881021847155010,Tue Mar 17 12:19:57 +0000 2026
0,chebyte,chebyte,ERC-8183 is trying to standardize how AI agents hire and pay each other  → Agent posts job + escrows funds  → Another agent delivers  → Evaluator (AI or contract) verifies  → Payment auto-released on-,https://twitter.com/chebyte/status/2033880755349111106,Tue Mar 17 12:18:54 +0000 2026
0,Alpha,AlAlphaResearch,The technical release is real and well built.  But the more interesting question is why Alibaba is giving this away for free.  The execution layer is where agent behavior becomes observable and contro,https://twitter.com/AlAlphaResearch/status/2033880709103014244,Tue Mar 17 12:18:43 +0000 2026
0,Card Promoter,CardPromoter,2017 Panini Donruss #327 Patrick Mahomes II Auto RC Rookie Mint bgs 9  auto 10 #ad #thehobby https://t.co/5NcstXapln https://t.co/VBytVFgXqZ,https://twitter.com/CardPromoter/status/2033740169719779741,Tue Mar 17 03:00:16 +0000 2026
0,@neurismo45,neurismo45,Mira esto: DAKA CGC FC BARCELONA INEFFABLE RAPHINHA AUTO /9 - MINT 9 https://t.co/yuQY4MK2rC #eBay via @eBay,https://twitter.com/neurismo45/status/2033687545133871147,Mon Mar 16 23:31:09 +0000 2026
0,Card Promoter,CardPromoter,Shohei Ohtani 2018 Leaf Super Rookie Patch Auto /35 BGS 9 Mint Autograph 💥📈💎 #ad #thehobby https://t.co/5NcstXapln https://t.co/ITpq6qGdcY,https://twitter.com/CardPromoter/status/2033674697808707751,Mon Mar 16 22:40:06 +0000 2026
0,Card Promoter,CardPromoter,2018 Contenders Josh Allen Rookie Ticket Auto No Feet #105 Clear #/10 PSA 9 Mint #ad #thehobby https://t.co/5NcstXapln https://t.co/D8bsK2yPmX,https://twitter.com/CardPromoter/status/2033664688534204812,Mon Mar 16 22:00:20 +0000 2026
0,Siege,thisappsucks001,Ur just playing farm sim blackops theft auto manager sim twentyseventyeleven,https://twitter.com/thisappsucks001/status/2033802497702146159,Tue Mar 17 07:07:56 +0000 2026
0,emans.ron,crypto_emans,Concrete DeFi USDT:  ~8.5% yield Auto-managed strategies Capital always working No idle funds. Just structured yield.,https://twitter.com/crypto_emans/status/2033870348492673085,Tue Mar 17 11:37:33 +0000 2026
0,Paravel,ParavelDAO,"Building @ParavelDAO: Autonomous AI agents for DeFi yield.   44 live atomic agents auto-allocate ETH/USDC across protocols (32% ann ret, Sharpe 7.6 thru Oct '25 crash).   Merkle-enforced (no hallucina",https://twitter.com/ParavelDAO/status/2033862476777795971,Tue Mar 17 11:06:16 +0000 2026
0,Herond Browser,HerondBrowser,"Why manage your wallet when your browser can do it for you? 🤖  Agentic browser doesn't just track data—it executes. From auto-swaps to yield optimization, let your digital assistant handle the heavy l",https://twitter.com/HerondBrowser/status/2033845802016137250,Tue Mar 17 10:00:00 +0000 2026
0,Fielding,fielding6988,5️⃣ Concrete builds the layer  Concrete vaults are the operating system DeFi deserves:  🧠 Allocators – smart capital deployment 📐 Strategy Managers – audited yield strategies 🛡️ Hook Managers – automa,https://twitter.com/fielding6988/status/2033817427096834077,Tue Mar 17 08:07:15 +0000 2026
0,Diana,Diana_MingCome,"PCB Selective Soldering Debugging: Trace &amp; Solve Defects in Seconds! 3D solder joint modeling with IPC-A-610 alignment auto-generates process optimizations, boosting yield 30%+. #pcba,#mingcome,#S",https://twitter.com/Diana_MingCome/status/2033799370643210640,Tue Mar 17 06:55:30 +0000 2026
